{
  "workflow_type": "global_impact_review_workflow",
  "workflow_version": "1.6.0",
  "workspace_id": "gic-workspace-bdc75d8b68333af2",
  "generated_at": "2026-07-17T20:41:01.523936+00:00",
  "roles": [
    {
      "role_id": "gic-role-39e14befc53a99182b21",
      "workspace_id": "gic-workspace-bdc75d8b68333af2",
      "name": "Approver",
      "description": "System role for approver workflow responsibilities.",
      "is_system": 1,
      "archived_at": null,
      "revision": 1,
      "created_at": "2026-07-17T20:41:01.517749+00:00",
      "updated_at": "2026-07-17T20:41:01.517749+00:00",
      "permissions": [
        "comment",
        "assess_quality",
        "approve",
        "reject"
      ],
      "metadata": {
        "role_key": "approver"
      }
    },
    {
      "role_id": "gic-role-6955e55a91af6bf53505",
      "workspace_id": "gic-workspace-bdc75d8b68333af2",
      "name": "Evidence Reviewer",
      "description": "System role for evidence reviewer workflow responsibilities.",
      "is_system": 1,
      "archived_at": null,
      "revision": 1,
      "created_at": "2026-07-17T20:41:01.517579+00:00",
      "updated_at": "2026-07-17T20:41:01.517579+00:00",
      "permissions": [
        "review_evidence",
        "comment",
        "assess_quality",
        "request_changes"
      ],
      "metadata": {
        "role_key": "evidence_reviewer"
      }
    },
    {
      "role_id": "gic-role-8472c44676e4c92c3ac0",
      "workspace_id": "gic-workspace-bdc75d8b68333af2",
      "name": "Methods Reviewer",
      "description": "System role for methods reviewer workflow responsibilities.",
      "is_system": 1,
      "archived_at": null,
      "revision": 1,
      "created_at": "2026-07-17T20:41:01.517677+00:00",
      "updated_at": "2026-07-17T20:41:01.517677+00:00",
      "permissions": [
        "review_methods",
        "comment",
        "assess_quality",
        "request_changes"
      ],
      "metadata": {
        "role_key": "methods_reviewer"
      }
    },
    {
      "role_id": "gic-role-1d6536354ae71f2d459d",
      "workspace_id": "gic-workspace-bdc75d8b68333af2",
      "name": "Program Owner",
      "description": "System role for program owner workflow responsibilities.",
      "is_system": 1,
      "archived_at": null,
      "revision": 1,
      "created_at": "2026-07-17T20:41:01.517385+00:00",
      "updated_at": "2026-07-17T20:41:01.517385+00:00",
      "permissions": [
        "edit",
        "submit_review",
        "respond_review",
        "open_correction"
      ],
      "metadata": {
        "role_key": "program_owner"
      }
    },
    {
      "role_id": "gic-role-63d359484d229519d7f8",
      "workspace_id": "gic-workspace-bdc75d8b68333af2",
      "name": "Publisher",
      "description": "System role for publisher workflow responsibilities.",
      "is_system": 1,
      "archived_at": null,
      "revision": 1,
      "created_at": "2026-07-17T20:41:01.517814+00:00",
      "updated_at": "2026-07-17T20:41:01.517814+00:00",
      "permissions": [
        "publish",
        "withdraw",
        "supersede"
      ],
      "metadata": {
        "role_key": "publisher"
      }
    }
  ],
  "review_assignments": [
    {
      "assignment_id": "gic-review-assignment-9df1f7f7011b0ccc9b9b",
      "workspace_id": "gic-workspace-bdc75d8b68333af2",
      "initiative_id": "gic-initiative-09a657f60923ed45",
      "subject_type": "contract",
      "subject_id": "gic-record-3bb3e632355d26c9",
      "reviewer_id": "reviewer@example.org",
      "role_id": "gic-role-39e14befc53a99182b21",
      "status": "approved",
      "priority": "high",
      "due_at": "2026-07-24T17:00:00+00:00",
      "assigned_by": "example-owner",
      "assigned_at": "2026-07-17T20:41:01.519645+00:00",
      "started_at": null,
      "completed_at": "2026-07-17T20:41:01.521031+00:00",
      "revision": 2,
      "created_at": "2026-07-17T20:41:01.519645+00:00",
      "updated_at": "2026-07-17T20:41:01.521031+00:00",
      "metadata": {}
    }
  ],
  "review_comments": [
    {
      "comment_id": "gic-review-comment-f5f014db83ed296c30c8",
      "assignment_id": "gic-review-assignment-9df1f7f7011b0ccc9b9b",
      "workspace_id": "gic-workspace-bdc75d8b68333af2",
      "initiative_id": "gic-initiative-09a657f60923ed45",
      "subject_type": "contract",
      "subject_id": "gic-record-3bb3e632355d26c9",
      "author_id": "reviewer@example.org",
      "parent_comment_id": null,
      "visibility": "workspace",
      "body": "Retain the seasonality limitation in the published brief.",
      "resolution_status": "resolved",
      "resolved_by": "example-owner",
      "resolved_at": "2026-07-17T20:41:01.520345+00:00",
      "revision": 2,
      "created_at": "2026-07-17T20:41:01.520110+00:00",
      "updated_at": "2026-07-17T20:41:01.520345+00:00",
      "metadata": {}
    }
  ],
  "quality_assessments": [
    {
      "assessment_id": "gic-quality-assessment-e7b4c0dab3724974ec17",
      "assignment_id": "gic-review-assignment-9df1f7f7011b0ccc9b9b",
      "workspace_id": "gic-workspace-bdc75d8b68333af2",
      "initiative_id": "gic-initiative-09a657f60923ed45",
      "subject_type": "contract",
      "subject_id": "gic-record-3bb3e632355d26c9",
      "rubric_id": "gic-core-quality",
      "rubric_version": "1.0",
      "assessor_id": "reviewer@example.org",
      "status": "submitted",
      "score": 85.0,
      "maximum_score": 100.0,
      "grade": "strong",
      "limitations": "",
      "revision": 1,
      "created_at": "2026-07-17T20:41:01.520559+00:00",
      "updated_at": "2026-07-17T20:41:01.520559+00:00",
      "submitted_at": "2026-07-17T20:41:01.520559+00:00",
      "dimensions": [
        {
          "finding": "Source version and locator are present.",
          "key": "evidence",
          "maximum_score": 100.0,
          "score": 85.0,
          "weight": 1.0
        },
        {
          "finding": "Method is appropriate with stated limitations.",
          "key": "method",
          "maximum_score": 100.0,
          "score": 80.0,
          "weight": 1.0
        },
        {
          "finding": "The claim traces to the canonical observation.",
          "key": "traceability",
          "maximum_score": 100.0,
          "score": 90.0,
          "weight": 1.0
        }
      ],
      "findings": [],
      "metadata": {}
    }
  ],
  "approval_decisions": [
    {
      "decision_id": "gic-approval-decision-fed2c8c8def5fa45a1bb",
      "assignment_id": "gic-review-assignment-9df1f7f7011b0ccc9b9b",
      "workspace_id": "gic-workspace-bdc75d8b68333af2",
      "initiative_id": "gic-initiative-09a657f60923ed45",
      "subject_type": "contract",
      "subject_id": "gic-record-3bb3e632355d26c9",
      "reviewer_id": "reviewer@example.org",
      "decision": "approve",
      "rationale": "Approved for public-interest reporting with the limitation retained.",
      "decided_at": "2026-07-17T20:41:01.521031+00:00",
      "supersedes_decision_id": null,
      "revision": 1,
      "conditions": [],
      "metadata": {}
    }
  ],
  "revisions": [
    {
      "workflow_revision_id": "gic-workflow-revision-9abbd1a2fc23d0079ae8",
      "workspace_id": "gic-workspace-bdc75d8b68333af2",
      "initiative_id": "gic-initiative-09a657f60923ed45",
      "subject_type": "contract",
      "subject_id": "gic-record-3bb3e632355d26c9",
      "revision_number": 1,
      "change_type": "create",
      "actor_id": "example-owner",
      "summary": "Canonical contract repository revision 1",
      "previous_content_hash": null,
      "content_hash": "7f46875fc7cf7b68c1195792f8841eec619ac320c519e46350388bdc43f17f13",
      "created_at": "2026-07-17T20:41:01.518234+00:00",
      "snapshot": {
        "boundaries": [
          "This contract is not an ESG assurance opinion, SDG certification, regulatory filing, or audit finding.",
          "Derived progress does not establish causality, contribution, attribution, or comparative superiority.",
          "Claims depend on documented sources, method design, indicator definition, and human review.",
          "Validation checks contract consistency; it does not automatically verify truth or source authenticity."
        ],
        "contract_type": "global_impact_contract",
        "contract_version": "1.1.0",
        "created_at": "2026-07-17T18:00:00+00:00",
        "derived": {
          "claims": [
            {
              "claim_type": "progress_to_target_statement",
              "confidence": "medium",
              "created_at": "2026-07-17T18:00:00+00:00",
              "design_metadata": {
                "causal_design": "",
                "comparison_basis": "",
                "contribution_rationale": "",
                "design_type": "before_after"
              },
              "eligibility": {
                "blocking_issue_ids": [],
                "eligible": true
              },
              "entity_type": "claim",
              "evidence_refs": [
                "gic-source-f2284ef9ae098b56",
                "gic-method-dfc0b951aac86076",
                "gic-baseline-bccde48f17ee3898",
                "gic-observation-cca59978f04bb0dd",
                "gic-target-61bc37e9887a3252"
              ],
              "id": "gic-claim-36fcd07621180653",
              "statement": "Estimated progress to target for Average monthly bill reduction is 60.00%.",
              "updated_at": "2026-07-17T18:00:00+00:00"
            }
          ],
          "interpretations": [
            {
              "created_at": "2026-07-17T18:00:00+00:00",
              "entity_type": "interpretation",
              "evidence_refs": [
                "gic-baseline-bccde48f17ee3898",
                "gic-observation-cca59978f04bb0dd",
                "gic-target-61bc37e9887a3252"
              ],
              "id": "gic-interpretation-fc8f22a961341a46",
              "interpretation_type": "metric_interpretation",